{
  "numero": 1,
  "titulo": "Dossiê Vertical: 5 Alternativas Open Source que Superam o Granola",
  "slug": "dossie-vertical-granola",
  "deck": "Análise técnica exaustiva para desmantelar o Granola (AI Meeting Notes). Conheça o Quinteto Soberano Open Source: a ferramenta mais robusta, a mais completa, a mais moderna, a mais leve e a mais simples, incluindo o ecossistema de servidores MCP e Skills de IA para automação total de reuniões sem vazamento de dados.",
  "saas_em_foco": {
    "nome": "Granola (AI Meeting Notepad)",
    "preco_medio": "US$ 120/ano por usuário (~R$ 720/ano)",
    "principais_limitacoes": "Obrigatoriedade de streaming de áudio para servidores remotos, limites de minutos mensais, falta de diarização customizada e dependência de nuvem de terceiros.",
    "riscos_privacidade": "Envio de discussões financeiras, código interno e segredos industriais de reuniões para servidores externos."
  },
  "stats": {
    "ferramentas": "5 Motores",
    "saas_substituidos": "Granola",
    "economia_anual": "R$ 36.000/ano (time de 50)",
    "licencas": "100% OSI"
  },
  "rotas": {
    "fragil": {
      "titulo": "Rota Frágil (Granola Cloud)",
      "desc": "Gravações corporativas hospedadas em servidores de terceiros, cobrança recorrente em dólar por funcionário e risco contínuo de vazamento sob leis estrangeiras."
    },
    "soberana": {
      "titulo": "Rota Soberana (Quinteto Open Source)",
      "desc": "Gravação e transcrição local com aceleração por hardware, separação de locutores em tempo real, integração nativa com MCP e confidencialidade estrita com LGPD."
    }
  },
  "quinteto": [
    {
      "rank": 1,
      "classificacao": "A Mais Completa",
      "nome": "Screenpipe (Captura 24/7 & Contexto Total)",
      "slug": "screenpipe",
      "saas_substituido": "Granola + Rewind.ai",
      "economia_anual_str": "R$ 14.400/ano",
      "licenca_osi": "Apache-2.0",
      "categoria": "Audio & Screen OCR Engine",
      "senioridade": "Sênior",
      "o_que_faz": "Grava áudio do microfone e da saída do sistema continuamente, transcreve com Whisper local e permite consultar qualquer reunião passada em linguagem natural.",
      "como_funciona": "Aplicação de alta performance em Rust que indexa áudio e capturas de tela em SQLite local com embeddings vetoriais, operando 100% offline.",
      "comando_rapido": "cargo run --release --bin screenpipe",
      "repositorio_github": "https://github.com/mediar-ai/screenpipe",
      "requisitos_infra": {
        "ram_minima": "4 GB RAM",
        "cpu_minima": "4 vCPU ou Apple Silicon"
      },
      "veredito": "O Screenpipe é o único sistema que supera o Granola em escopo: ele não depende de você clicar em 'gravar' e integra diretamente com agentes de IA via MCP.",
      "passos_praticos": [
        {
          "titulo": "Instalação do Binário",
          "descricao": "Baixe o binário pré-compilado para macOS, Windows ou Linux e ative o serviço de captura em background."
        },
        {
          "titulo": "Configuração de Modelos",
          "descricao": "Selecione o modelo Whisper (base, small ou large-v3) e defina o provedor de LLM local (Ollama ou LM Studio)."
        },
        {
          "titulo": "Consulta via Chat",
          "descricao": "Abra a UI ou pergunte ao seu agente de IA: 'Qual foi o valor do orçamento aprovado na reunião de ontem às 15h?'"
        }
      ],
      "uso_complementar": [
        {
          "tipo": "MCP Server",
          "nome": "@mediar-ai/screenpipe-mcp",
          "comando_ou_repo": "npx -y @mediar-ai/screenpipe-mcp",
          "descricao": "Servidor oficial de Model Context Protocol que permite ao Claude Code, Cursor e Antigravity buscarem trechos de áudio e tela gravados."
        },
        {
          "tipo": "Agent Skill",
          "nome": "skill-screenpipe-query",
          "comando_ou_repo": ".claude/skills/screenpipe-query/SKILL.md",
          "descricao": "Skill especializada que resume atas executivas no padrão ISO com identificação de prazos e responsáveis a partir de dados do Screenpipe."
        },
        {
          "tipo": "CLI Tool",
          "nome": "screenpipe-cli",
          "comando_ou_repo": "screenpipe pipe search 'orçamento 2026'",
          "descricao": "Interface de terminal para filtrar transcrições por palavras-chave, timestamps e nomes de janelas ativas."
        }
      ],
      "design_system": {
        "esforco": "Mínimo (Plug & Play)",
        "stack_ui": "Tauri + Next.js + Tailwind",
        "white_label_nativo": true,
        "mecanica_customizacao": "O cliente desktop do Screenpipe é construído em Next.js/Tailwind envelopado em Tauri. Permite customizar paleta de cores institucional, logotipo e fontes corporativas via tokens de CSS ou arquivo de configuração de tema.",
        "manutenibilidade_upgrades": "Risco Zero: O motor de captura e busca semântica em Rust opera desacoplado da interface visual, garantindo que atualizações de versão não sobrescrevam a identidade visual da empresa."
      }
    },
    {
      "rank": 2,
      "classificacao": "A Mais Robusta",
      "nome": "WhisperX + PyAnnote (Diarização Industrial)",
      "slug": "whisperx",
      "saas_substituido": "Granola Enterprise Diarization",
      "economia_anual_str": "R$ 18.000/ano",
      "licenca_osi": "BSD-4-Clause",
      "categoria": "Speech-to-Text & Speaker Diarization",
      "senioridade": "Sênior",
      "o_que_faz": "Transcreve gravações com alinhamento temporal em nível de palavra (word-level timestamps) e identifica com precisão cirúrgica quem falou cada frase.",
      "como_funciona": "Combina a velocidade do Faster-Whisper (CTranslate2) com o modelo de diarização acústica PyAnnote Audio e alinhamento fonético via wav2vec2.",
      "comando_rapido": "pip install whisperx && whisperx reuniao.mp3 --diarize --hf_token HF_TOKEN",
      "repositorio_github": "https://github.com/m-bain/whisperX",
      "requisitos_infra": {
        "ram_minima": "4 GB RAM",
        "cpu_minima": "4 vCPU / GPU NVIDIA (Recomendada)"
      },
      "veredito": "Para empresas com dezenas de participantes falando ao mesmo tempo, o WhisperX é a solução mais robusta do planeta, superando qualquer SaaS comercial.",
      "passos_praticos": [
        {
          "titulo": "Preparação do Ambiente",
          "descricao": "Instale o WhisperX com aceleração CUDA via pip ou utilize a imagem Docker oficial."
        },
        {
          "titulo": "Execução com Diarização",
          "descricao": "Passe o arquivo de áudio da reunião definindo `--min_speakers` e `--max_speakers` para separar os interlocutores."
        },
        {
          "titulo": "Exportação Estruturada",
          "descricao": "Gere saídas automáticas em JSON, VTT ou SRT prontas para indexação e busca semântica."
        }
      ],
      "uso_complementar": [
        {
          "tipo": "Sidecar Plugin",
          "nome": "pyannote.audio",
          "comando_ou_repo": "https://github.com/pyannote/pyannote-audio",
          "descricao": "Motor neural de biometria vocal e diarização treinado em centenas de milhares de horas de conversa multilocutor."
        },
        {
          "tipo": "Agent Skill",
          "nome": "skill-transcript-cleaner",
          "comando_ou_repo": ".claude/skills/transcript-cleaner/SKILL.md",
          "descricao": "Skill de pós-processamento que remove vícios de linguagem ('né', 'tipo', 'humm') e atribui nomes reais aos identificadores SPEAKER_00."
        },
        {
          "tipo": "CLI Tool",
          "nome": "whisperx-batch",
          "comando_ou_repo": "whisperx --model large-v3 --language pt *.wav",
          "descricao": "Processamento em lote capaz de transcrever um dia inteiro de reuniões em poucos minutos usando GPU."
        }
      ],
      "design_system": {
        "esforco": "Headless (UI Livre)",
        "stack_ui": "API REST / Python Headless",
        "white_label_nativo": true,
        "mecanica_customizacao": "Motor puramente headless e agnóstico de interface. Permite que seu time de desenvolvimento conecte o frontend corporativo oficial (React, Vue, Next.js) usando 100% dos componentes do Design System da sua empresa.",
        "manutenibilidade_upgrades": "Isolamento Completo: O serviço roda isolado em container Docker. Atualizações no modelo acústico ou alinhamento fonético têm impacto zero na camada de apresentação visual."
      }
    },
    {
      "rank": 3,
      "classificacao": "A Mais Moderna",
      "nome": "Open-NotebookLM (Podcasts & Síntese em Áudio)",
      "slug": "open-notebooklm",
      "saas_substituido": "Granola AI Summary + NotebookLM",
      "economia_anual_str": "R$ 12.000/ano",
      "licenca_osi": "Apache-2.0",
      "categoria": "Audio Dialogue Generation & RAG",
      "senioridade": "Pleno",
      "o_que_faz": "Transforma notas e atas de reunião em resumos executivos conversacionais falados por dois apresentadores de IA com entonação natural.",
      "como_funciona": "Extrai pontos-chave com LLM local, formata um roteiro dinâmico de perguntas e respostas e sintetiza vozes com modelos acústicos (Bark/XTTS).",
      "comando_rapido": "git clone https://github.com/gabrielchua/open-notebooklm && pip install -r requirements.txt",
      "repositorio_github": "https://github.com/gabrielchua/open-notebooklm",
      "requisitos_infra": {
        "ram_minima": "8 GB RAM",
        "cpu_minima": "4 vCPU ou GPU com 6GB VRAM"
      },
      "veredito": "A abordagem mais moderna para diretoria: em vez de ler um PDF de 20 páginas, ouça um podcast de 5 minutos resumindo as decisões da reunião.",
      "passos_praticos": [
        {
          "titulo": "Upload das Notas",
          "descricao": "Alimente a ferramenta com a transcrição da reunião ou os slides apresentados."
        },
        {
          "titulo": "Geração do Roteiro",
          "descricao": "A IA analisa debates, objeções e acordos, escrevendo um diálogo envolvente entre dois analistas."
        },
        {